sentence,cleanliness,comfort,amenities,staff,value,wifi,location,other
Nel bagno la muffa e il calcare la fanno da padrone nel vano doccia.,negative,neutral,neutral,neutral,neutral,neutral,neutral,neutral
"La posizione dell'albergo e' ottima, vicino alla metro, in pieno centro.",neutral,neutral,neutral,neutral,neutral,neutral,positive,neutral
"Buona posizione, facile da trovare, colazione variegata e abbondante, camere carine e perfettamente pulite, cartine della città a disposizione di tutti, personale gentile e disponibile",positive,positive,positive,positive,neutral,neutral,positive,neutral
La camera e  troppo calda e d  inverno non funzionano i condizionatori.,neutral,negative,neutral,neutral,neutral,neutral,neutral,neutral
hotel era molto scomodo arrivarci specialmente con 2 bimbi e un passeggino.,neutral,neutral,neutral,neutral,neutral,neutral,negative,neutral
Personale poco ospitale soprattutto le donne .,neutral,neutral,neutral,negative,neutral,neutral,neutral,neutral
"Colazione pover, camera piccola",neutral,negative,negative,neutral,neutral,neutral,neutral,neutral
Con questa location andrebbe ristrutturato tutto l'hotel  anche l'ascensore è molto vecchio  e potrebbero chiedere anche di più per notte.,neutral,negative,neutral,neutral,neutral,neutral,neutral,neutral
televisione non presente in camera.,neutral,neutral,negative,neutral,neutral,neutral,neutral,neutral
Siamo rimasti piacevolmente soddisfatti da  la comodità della struttura   la disponibilità dello staff   la pulizia della camera   la tranquillità della zona,positive,positive,neutral,positive,neutral,neutral,positive,neutral
Arredo un po' usurato,neutral,neutral,neutral,neutral,neutral,neutral,neutral,negative
"Il ragazzo dal reception è maleducato, dice insulti a stranieri.",neutral,neutral,neutral,negative,neutral,neutral,neutral,neutral
stanze troppo piccole e si sentono tutti i rumori,neutral,negative,neutral,neutral,neutral,neutral,neutral,neutral
"Il bagno è da ristuccare,nella doccia c'erano le fughe molto molto rovinate,cornetta doccia e rubinetti con tanto calcare,ma comunque puliti",positive,neutral,neutral,neutral,neutral,neutral,neutral,negative
"La prima camera che ci é stata data era pessima,antica,senza nemmeno le prese della corrente.",neutral,neutral,negative,neutral,neutral,neutral,neutral,negative
"Senza dubbio i materassi, nell'epoca del Memory , li avete proprio obsoleti, in un Hotel  4 stelle fanno proprio una brutta figura.",neutral,negative,neutral,neutral,neutral,neutral,neutral,neutral
"L acqua in camera non è un servizio gratuito, come la maggior parte degli hotel di questa categoria, anzi caramente pagata, come anche la colazione di un livello per nulla in linea con quello che l hotel vuole apparire.",neutral,neutral,negative,neutral,neutral,neutral,neutral,neutral
La moquette del pavimento che era sporca.,negative,neutral,neutral,neutral,neutral,neutral,neutral,neutral
Sono rimasto colpito dalla vastità di scelta della colazione .,neutral,neutral,positive,neutral,neutral,neutral,neutral,neutral
L'eccessivo caldo in camera,neutral,negative,neutral,neutral,neutral,neutral,neutral,neutral
"Tavoletta del water usurata e rotta, con presenza di nastro adesivo.",neutral,negative,neutral,neutral,neutral,neutral,neutral,neutral
"ottima posizione, camere spaziose",neutral,positive,neutral,neutral,neutral,neutral,positive,neutral
Puzza di fumo nelle camere  benché non si potesse fumare  e poca luminosità.,neutral,negative,neutral,neutral,neutral,neutral,neutral,neutral
"La struttura se così si può chiamare, si trova al 4 piano di uno stabile privato, più che hotel un B B di buono livello.",neutral,negative,neutral,neutral,neutral,neutral,neutral,neutral
Molta scelta di dolce e una vasta selezione di prodotti senza glutine e lattosio.,neutral,neutral,positive,neutral,neutral,neutral,neutral,neutral
colazione inclusa  ma in un bar  esterno e non in hotel.,neutral,neutral,negative,neutral,neutral,neutral,neutral,neutral
Camere ampie e pulite.,positive,positive,neutral,neutral,neutral,neutral,neutral,neutral
La mia camera aveva all ' inizio un odore sgradevole,negative,neutral,neutral,neutral,neutral,neutral,neutral,neutral
WIFI in camera molto lento,neutral,neutral,neutral,neutral,neutral,negative,neutral,neutral
"Camere piccolissime, molto al di sotto delle mie aspettative.",neutral,negative,neutral,neutral,neutral,neutral,neutral,neutral
ottima esperienza comunque nel complesso.,neutral,neutral,neutral,neutral,neutral,neutral,neutral,positive
Non c'è un vero parcheggio dell'Hotel e quello di cui si serve ha un  costo giornaliero piuttosto elevato,neutral,neutral,negative,neutral,negative,neutral,neutral,neutral
giungo molta poca professionalità di una addetta alle colazioni che in napoletano stretto  da me compreso  ha espresso dei commenti a voce neanche troppo bassa su quanto altri ospiti stavano mangiando.,neutral,neutral,neutral,negative,neutral,neutral,neutral,neutral
Ottima la colazione tanta roba buona e tanta pulizia.,positive,neutral,positive,neutral,neutral,neutral,neutral,neutral
la moquette nelle stanze era rovinata e dava un senso di poca pulizia.,negative,neutral,neutral,neutral,neutral,neutral,neutral,neutral
Tutta la struttura ok,neutral,neutral,neutral,neutral,neutral,neutral,neutral,positive
troppo 4   la bottiglietta d'acqua trovata nel frigo.,neutral,neutral,neutral,neutral,negative,neutral,neutral,neutral
Posizione e cortesia dello staff,neutral,neutral,neutral,positive,neutral,neutral,positive,neutral
"La stanza era molto carina, il letto matrimoniale alla francese eccezionale, la colazione ottima ed abbondante.",neutral,positive,positive,neutral,neutral,neutral,neutral,neutral
L'hotel si trova in una posizione strategica per visitare i principali monumenti quartieri di Napoli a piedi.,neutral,neutral,neutral,neutral,neutral,neutral,positive,neutral
Posizionati molto vicini alla stazione centrale e facilmente raggiungibile,neutral,neutral,neutral,neutral,neutral,neutral,positive,neutral
Il ristorante serviva pochissimi aperitivi e la cena è stata servita in camera senza pane.,neutral,neutral,negative,neutral,neutral,neutral,neutral,neutral
Le stanze messe a nuovo da poco ma comunque non sono ben fatte.,neutral,negative,neutral,neutral,neutral,neutral,neutral,neutral
Qualche accortezza in più per la categoria dell'hotel ci vorrebbe.,neutral,neutral,neutral,neutral,neutral,neutral,neutral,negative
Buffet colazione buono ma con poca varietà,neutral,neutral,negative,neutral,neutral,neutral,neutral,neutral
"Si possono considerare accoglienti solo perchè sono state terminate da poco, ma sono le classiche camere che dopo diversi alloggi iniziano a cedere.",neutral,negative,neutral,neutral,neutral,neutral,neutral,neutral
"Molto comodo il bar in cui si accede direttamente dalla struttura, specie per chi come noi non usufruisce della colazione compresa nel prezzo della camera",neutral,neutral,positive,neutral,neutral,neutral,neutral,neutral
"Non è assolutamente un hotel ma bensì un mediocre B B in un palazzo anni 60 con portineria soltanto per trovarlo , visto che cercavamo un insegna Hotel , ci abbiamo messo la bellezza di 20 minuti .",neutral,neutral,neutral,neutral,neutral,neutral,neutral,negative
"Sala colazioni sottodimensionata  a colazione molti extra a pagamento, per generi di solito ricompresi per default anche in hotel di lignaggio nettamente inferiore.",neutral,negative,negative,neutral,negative,neutral,neutral,neutral
"non sono riuscita ad accendere la televisione nonostante le istruzioni   meglio , ho dormito",neutral,neutral,negative,neutral,neutral,neutral,neutral,neutral
"La camera in cui abbiamo soggiornato aveva subito un lifting, hanno trascurato però il bagno dotato di una vasca  in pessime condizioni e con la rubinetteria consumata e arrugginita.",neutral,negative,neutral,neutral,neutral,neutral,neutral,neutral
Le luci in  camera sono tutte molto forti,neutral,negative,neutral,neutral,neutral,neutral,neutral,neutral
"Titolare che bussava nelle camere sino a tardi, anche nella nostra, per avere delucidazioni sulla prenotazione  .",neutral,neutral,neutral,negative,neutral,neutral,neutral,neutral
La spremuta deve essere con frutta fresca,neutral,neutral,negative,neutral,neutral,neutral,neutral,neutral
La colazione è ricca e di assoluta soddisfazione,neutral,neutral,positive,neutral,neutral,neutral,neutral,neutral
Perché mi hanno assegnato una stanza e delle condizioni che non avevo prenotato all'hotel viennese2.,neutral,neutral,negative,neutral,neutral,neutral,neutral,neutral
La cena collettiva organizzata dallo staff è stata molto piacevole e coinvolgente.,neutral,neutral,neutral,positive,neutral,neutral,neutral,neutral
l'esterno del fabbricato è decadente come peraltro l'ambiente esterno.,neutral,negative,neutral,neutral,neutral,neutral,neutral,neutral
Buon rapporto qualita prezzo,neutral,neutral,neutral,neutral,neutral,neutral,positive,neutral
"Il cantiene di fronte toglie la possibilità di apprezzare appieno la visuale, ma quando sarà ultimato, insieme la zona multietnica, lo renderà un buon compromesso per un hotel in zona.",neutral,neutral,neutral,neutral,neutral,neutral,negative,neutral
La camera ed il bagno erano abbastanza puliti.,positive,neutral,neutral,neutral,neutral,neutral,neutral,neutral
Insonorizzazione delle camere migliorabile.,neutral,negative,neutral,neutral,neutral,neutral,neutral,neutral
Roadhouse attaccata all'hotel per chi vuole cenare e muoversi a piedi.,neutral,neutral,neutral,neutral,neutral,neutral,neutral,positive
Ristorante carissimo per qualità.,neutral,neutral,negative,neutral,negative,neutral,neutral,neutral
Il personale alla reception e al ristorante è stato molto gentile,neutral,neutral,neutral,positive,neutral,neutral,neutral,neutral
"personale meraviglioso e disponibile, colazione fantastica anche quando affollato, location degna del migliore salotto di napoli",neutral,positive,positive,positive,neutral,neutral,neutral,neutral
"la posizione, la vista fronte mare",neutral,neutral,neutral,neutral,neutral,neutral,positive,neutral
"Connessione wifi molto lenta, alla fine si deve optare per l'opzione business a pagamento se si vuole navigare in modo decente.",neutral,neutral,neutral,neutral,negative,negative,neutral,neutral
Al momento del check out si e scoperto che il ZPOS non funzionava  .,neutral,neutral,negative,neutral,neutral,neutral,neutral,neutral
"Camera ampia e silenziosa, purtroppo era posizionata al piano terra e dava su un cortile interno un pò deprimente.",neutral,positive,neutral,neutral,neutral,neutral,neutral,negative
"Ascensore vecchio e consunto, scale da revisionare, materasso durissimo, colazione cosi cosi...",neutral,negative,negative,neutral,neutral,neutral,neutral,neutral
La doccia erogava un filo d'acqua e quattro piccole bustine di bagnoschiuma che potevano bastare per una sola persona.,neutral,negative,negative,neutral,neutral,neutral,neutral,neutral
Troppo caldo in camera  per fortuna regolabile autonomamente,neutral,negative,neutral,neutral,neutral,neutral,neutral,neutral
Arredi nuovi tutto molto pulito e funzionale.,positive,positive,neutral,neutral,neutral,neutral,neutral,neutral
Non so se ho avuto un prezzo particolarmente conveniente ma il rapporto qualità prezzo è ottimo.,neutral,neutral,neutral,neutral,positive,neutral,neutral,neutral
"L'hotel è grazioso all'interno, doveva essere una gran bella casa, un tempo.",neutral,neutral,neutral,neutral,neutral,neutral,neutral,positive
Mancavano i mobili basilari.,neutral,negative,neutral,neutral,neutral,neutral,neutral,neutral
"Molto buona l'insonorizzazione della camera, credo sia impossibile renderla totale vista la posizione sulla strada di una camera al primo piano.",neutral,positive,neutral,neutral,neutral,neutral,neutral,neutral
"Colazione inesistente, camera non idonea, bagno piccolissimo",neutral,negative,negative,neutral,neutral,neutral,neutral,neutral
Prezzo caro per i servizi offerti  considerato il solo pernottamento senza colazione,neutral,neutral,neutral,neutral,negative,neutral,neutral,neutral
"alcuni ospiti poco educati che si sono fermati a fumare e chiacchierare nella corte interna proprio davanti alla mia finestra, ma l'educazione dei clienti non compete all'albergatore .....",neutral,neutral,neutral,neutral,neutral,neutral,neutral,negative
Il servizio la prima notte abbiamo dormito in un altra struttura il bagno freddissimo senza phon senza pulizia e senza teli bagno cambiati non abbiamo chiuso occhio per colpa di 5 ragazzi che facevano chiasso e nessuno li ha ripresi perche questo non accadesse non torneremo più,negative,negative,neutral,negative,neutral,neutral,neutral,neutral
L'accoglienza e la simpatia ... la ristrutturazione degli spazi occupati dall'hotel,neutral,neutral,neutral,positive,neutral,neutral,neutral,positive
"Ottima la posizione nel cuore di Napoli,  il personale gentile, disponibile e simpatico",neutral,neutral,neutral,positive,neutral,neutral,positive,neutral
"Dopo essere rimasta 10 minuti in quella camera, mi sono rifiutata di restare per la notte  da notare che i proprietari non mi hanno nemmeno chiesto il motivo del mio rifiuto, evidentemente sapevano bene che era una camera improponibile.",neutral,negative,neutral,neutral,neutral,neutral,neutral,neutral
Molto buona la colazione.,neutral,neutral,positive,neutral,neutral,neutral,neutral,neutral
ascensore rotto  hotel molto buio troppo caro,neutral,negative,neutral,neutral,negative,neutral,neutral,neutral
Non ho gradito la vista della camera che affacciava all'interno del cortile.,neutral,neutral,neutral,neutral,neutral,neutral,neutral,negative
"insonorizzazione pessima, sembrava di dormire in strada",neutral,negative,neutral,neutral,neutral,neutral,neutral,neutral
"C era un fastidioso rumore nella camera durante la notte, simile a un ronzio.",neutral,negative,neutral,neutral,neutral,neutral,neutral,neutral
L albergo ha bisogno di una ristrutturazione,neutral,neutral,neutral,neutral,neutral,neutral,neutral,negative
"L impianto di climatizzazione molto rumoroso, il terzo letto messo nella stanza dove era presente un acquaio e uno scalda vivande",neutral,negative,neutral,neutral,neutral,neutral,neutral,neutral
Staff supergentile e preparato.,neutral,neutral,neutral,positive,neutral,neutral,neutral,neutral
Bagno sporco già all arrivo.,negative,neutral,neutral,neutral,neutral,neutral,neutral,neutral
"L'ingresso prima di entrare nel locale  fino all'ascensore  è piuttosto scadente, ma una volta arrivati al piano dell'hotel è un'altra cosa",neutral,neutral,neutral,neutral,neutral,neutral,neutral,negative
Il letto un po' scomodo ma accettabile .,neutral,negative,neutral,neutral,neutral,neutral,neutral,neutral
"Il letto comodo , stanza spaziosa",neutral,positive,neutral,neutral,neutral,neutral,neutral,neutral
la mancanza del frigobar in camera.,neutral,neutral,negative,neutral,neutral,neutral,neutral,neutral
"La mancanza di bidet e colazione, ma ho prenotato consapevolmente.",neutral,neutral,negative,neutral,neutral,neutral,neutral,neutral
"ottima posizione, buon livello di servizio",neutral,neutral,positive,neutral,neutral,neutral,positive,neutral
nulla da segnalare....un'ottima struttura,neutral,neutral,neutral,neutral,neutral,neutral,neutral,positive
Il letto era molto scomodo.,neutral,negative,neutral,neutral,neutral,neutral,neutral,neutral
"Abbiamo avuto il cambio degli asciugamani ogni giorno ,lo staff è disponibile e cordiale.",neutral,neutral,positive,positive,neutral,neutral,neutral,neutral
La camera ricevuta non era quella prenotata.,neutral,neutral,neutral,neutral,neutral,neutral,neutral,negative
"Buone le dotazioni accessorie  lametta, spazzolino, erogatori di sapone Dove  mancano solo le ciabattine Bella la posizione, personale cordiale e disponibile.",neutral,neutral,positive,positive,neutral,neutral,positive,neutral
per il prezzo si tratta di un buon servizio,neutral,neutral,neutral,neutral,positive,neutral,neutral,neutral
La stanza è molto piccola,neutral,negative,neutral,neutral,neutral,neutral,neutral,neutral
Arrivata in questa struttura ho aspettato più di un ora che mi preparassero la camera che avevo prenotato con tanto di orario specificato di arrivo.,neutral,neutral,negative,negative,neutral,neutral,neutral,neutral
I 2 materassi singoli uniti scomodissimi,neutral,negative,neutral,neutral,neutral,neutral,neutral,neutral
"Dovrebbero passare i controlli per questa struttura,sarebbe da chiudere e dargli una bella ripulita",negative,negative,neutral,neutral,negative,neutral,neutral,neutral
"Bella struttura e ben arredata  camere accoglienti, funzionali e pulite.",positive,positive,neutral,neutral,neutral,neutral,neutral,neutral
Buona colazione e prezzo soggiorno giusto.,neutral,neutral,positive,neutral,positive,neutral,neutral,neutral
Aree comuni fredde e insignificanti,neutral,neutral,neutral,neutral,neutral,neutral,neutral,negative
"la cordialità dello staff , la grandezza della camera e la bellezza dell'albergo in generale",neutral,positive,neutral,positive,neutral,neutral,neutral,neutral
Si suggerisce un miglioramento del deposito bagagli al check out con etichettamento degli stessi.,neutral,neutral,negative,neutral,neutral,neutral,neutral,neutral
Sala colazioni con vista stupenda su Castel dell'Ovo e Posillipo.,neutral,neutral,neutral,neutral,neutral,neutral,positive,neutral
Doccia non funzionante e vaso del bagno scomodo perchè adiacente alla doccia e privo di copertura.,neutral,negative,neutral,neutral,neutral,neutral,neutral,neutral
fogli adesivi per coprire il vetro del bagno penzolante ...serratura porta ingresso rotta.,neutral,negative,neutral,neutral,neutral,neutral,neutral,neutral
"Persona di reception era competente, si chiama Beatrice, era velocissima di darce il servizio",neutral,neutral,neutral,positive,neutral,neutral,neutral,neutral
"Unico difetto della struttura è la posizione un po' distante dal centro, ma comunque facilmente raggiungibile in taxi con tariffe ridotte o un po' meno facilmente con i mezzi pubblici.",neutral,neutral,neutral,neutral,neutral,neutral,negative,neutral
da migliorare la manutenzione nel bagno,neutral,neutral,negative,neutral,neutral,neutral,neutral,neutral
Stanza un po' fredda nonostante fosse piccola.,neutral,negative,neutral,neutral,neutral,neutral,neutral,neutral
"Dato che non c'è aria condizionata, ma solo un ventilatore ci vorrebbero zanzariere alle finestre per poterle tenere aperte.",neutral,negative,neutral,neutral,neutral,neutral,neutral,neutral
Posizione  comoda x andare in centro e raggiungibile comodamente dall'autostrada.,neutral,neutral,neutral,neutral,neutral,neutral,positive,neutral
"La posizione dell' hotel è limitrofa alla stazione centrale, ma è anche molto comodo per collegarsi al resto della città.",neutral,neutral,neutral,neutral,neutral,neutral,positive,neutral
"Un posto meraviglioso, posizione ottima anche per chi viaggia senza auto,  personale gentile, attento alle necesità degli ospiti.",neutral,neutral,neutral,positive,neutral,neutral,positive,neutral
"Ho trovato un albergo con un arredo anni 50, sporco, senza possibilità di fare colazione o altro",negative,negative,negative,neutral,neutral,neutral,neutral,neutral
"Non mi è piaciuto nulla  una struttura dove non tornerei La pulizia era assente,non avevamo il coraggio di farci una doccia per quanto era sporco Scarico del Water rotto.",negative,negative,negative,neutral,neutral,neutral,neutral,neutral
"La camera piccola  Bagno piccolissimo, impossibile fare la doccia braccio  doccia rotto",neutral,negative,neutral,neutral,neutral,neutral,neutral,neutral
Camera accogliente e confortevole,neutral,positive,neutral,neutral,neutral,neutral,neutral,neutral
"Quando siamo appena arrivati e quando siamo tornati in albergo, dalle nostre passeggiate in città, abbiamo aspettato un po' suonando il campanello diverse volte, aspettando che ci aprissero.",neutral,neutral,neutral,negative,neutral,neutral,neutral,neutral
quindi ho passato due notti insonni.,neutral,negative,neutral,neutral,neutral,neutral,neutral,neutral
Il WiFi non andava per un problema alla rete.,neutral,neutral,neutral,neutral,neutral,negative,neutral,neutral
Perfetto per chi viaggia per lavoro.,neutral,neutral,neutral,neutral,neutral,neutral,neutral,positive
La possibilita' di poter parcheggiare in un garage privato che dista circa 10 metri dall'albergo.,neutral,neutral,positive,neutral,neutral,neutral,neutral,neutral
L'invadenza della cameriera con domande personali,neutral,neutral,neutral,negative,neutral,neutral,neutral,neutral
Staff sempre presente ed a disposizione.,neutral,neutral,neutral,positive,neutral,neutral,neutral,neutral
"Colazione abbondante, parcheggio perché necessario trovandoci al centro del Vomero",neutral,neutral,positive,neutral,neutral,neutral,neutral,neutral
Ci hanno assegnato una camera non molto ampia.,neutral,negative,neutral,neutral,neutral,neutral,neutral,neutral
Costo estremamente eccessivo per una struttura dal mobilio spesso consumato e rovinato.,neutral,neutral,neutral,neutral,negative,neutral,neutral,neutral
Location per la colazione molto piacevole,neutral,neutral,neutral,neutral,neutral,neutral,positive,neutral
"Camere spaziose,pulite e silenziose.",positive,positive,neutral,neutral,neutral,neutral,neutral,neutral
"Sommariamente gli aspetti positivi riescono a prendere il sopravvento su quelli negativi, ma purtroppo ho riscontrato alcuni piccoli difetti.",neutral,neutral,neutral,neutral,neutral,neutral,neutral,negative
Buono il materasso,neutral,positive,neutral,neutral,neutral,neutral,neutral,neutral
Camera confortevole,neutral,positive,neutral,neutral,neutral,neutral,neutral,neutral
"La pulizia delle camere, anche se nel complesso discreta, presentava poca cura dei dettagli, esempio box doccia o porta del bagno.",negative,neutral,neutral,neutral,neutral,neutral,neutral,neutral
Lo stile sostanzialmente moderno in una struttura ristrutturata in pieno centro.,neutral,positive,neutral,neutral,neutral,neutral,neutral,neutral
Il personale non ha fatto granché per rimediare.,neutral,neutral,neutral,negative,neutral,neutral,neutral,neutral
"Il personale è stato estremamente gentile, ci ha fornito un sacco di indicazioni per visitare al meglio la città e per mangiare.",neutral,neutral,neutral,positive,neutral,neutral,neutral,neutral
La colazione poi è una delle migliori che io abbia provato.,neutral,neutral,positive,neutral,neutral,neutral,neutral,neutral
Accoglienza super e posizione dell'ostello strategica,neutral,neutral,neutral,positive,neutral,neutral,positive,neutral
"La gentilezza delle persone , la colazione , la posizione e il letto comodissimo.",neutral,positive,positive,positive,neutral,neutral,positive,neutral
"A pochi min dall'hotel è possibile visitare il Duomo, il Cristo Velato, Napoli Sotteranea, San Gregorio Armeno, il Chiostro di S.",neutral,neutral,neutral,neutral,neutral,neutral,positive,neutral
Posizione ottima è staff cordiale e preparato,neutral,neutral,neutral,positive,neutral,neutral,positive,neutral
Il salone destinato alle colazioni pur molto bello in quanto riccamente decorato avrebbe bisogno di essere restaurato e quantomeno occorrerebbe provvedere alla sostituzione degli infissi.,neutral,negative,neutral,neutral,neutral,neutral,neutral,neutral
Il servizio in camera.,neutral,neutral,positive,neutral,neutral,neutral,neutral,neutral
Personale attento e solerte.,neutral,neutral,neutral,positive,neutral,neutral,neutral,neutral
"Ampio parcheggio gratuito , ottima posizione e buona colazione",neutral,neutral,positive,neutral,neutral,neutral,positive,neutral
Comodissimo per chi arriva in treno.,neutral,neutral,neutral,neutral,neutral,neutral,positive,neutral
Andrebbe  rinfrescata .,neutral,neutral,neutral,neutral,neutral,neutral,neutral,negative
La notte continui schiamazzi e rumori dalle stanze a fianco.,neutral,negative,neutral,neutral,neutral,neutral,neutral,neutral
"La pulizia lascia alquanto a desiderare, anche le stanze troppo piccole per 4 persone",negative,negative,neutral,neutral,neutral,neutral,neutral,neutral
Hotel davvero sporco credo che anche se una famiglia chieda solo di dormire un minimo di pulizia sia doverosa,negative,neutral,neutral,neutral,neutral,neutral,neutral,neutral
RAPPORTO QUALITA' PREZZO NEGATIVO.,neutral,neutral,neutral,neutral,negative,neutral,neutral,neutral
L'hotel è in pieno centro e a pochissima distanza dalla stazione.,neutral,neutral,neutral,neutral,neutral,neutral,positive,neutral
Rapporto qualità prezzo ottimo,neutral,neutral,neutral,neutral,positive,neutral,neutral,neutral
"La mia camera era stupenda,elegante e piena di bei quadri   però era buia  ho però notato...che solo la mia  camera era buia .",neutral,negative,neutral,neutral,neutral,neutral,neutral,neutral
"La colazione è ottima, il personale di sala è a disposizione e prepara sul posto pietanze calde come le uova se lo desiderate.",neutral,neutral,positive,positive,neutral,neutral,neutral,neutral
Posizione ottima vicino i migliori albergo di Napoli a 10 minuti a piedi da piazza plebiscito,neutral,neutral,neutral,neutral,neutral,neutral,positive,neutral
Pulizia e colazione ottima,positive,neutral,positive,neutral,neutral,neutral,neutral,neutral
"L'hotel si trova in zona centrale, a due passi dal centro storico e dalla Spaccanapoli",neutral,neutral,neutral,neutral,neutral,neutral,positive,neutral
"La stanza era vecchia con una parete di cemento fortunatamente ricoperta da una tenda, la finestra piccolissima .",neutral,negative,neutral,neutral,neutral,neutral,neutral,neutral
"Il bagno era sì pulito superficialmente, ma in condizioni strutturali non all'altezza di un 3 stelle  doccia con muffa verde sul portasapone, lavandino con filtro dell'acqua rotto, tendina in doccia di plastica che è una cosa davvero poco igienica .",negative,neutral,neutral,neutral,neutral,neutral,neutral,neutral
