sentence,cleanliness,comfort,amenities,staff,value,wifi,location,other
X me andava bene tutto x mio marito no,neutral,neutral,neutral,neutral,neutral,neutral,neutral,negative
Stanze troppo piccole e senza scrivania,neutral,negative,neutral,neutral,neutral,neutral,neutral,neutral
Sorpresa piacevole il sistema audio gestibile da bluetooth.,neutral,neutral,positive,neutral,neutral,neutral,neutral,neutral
"Buona colazione, wi fi rapido anche ai piani alti, camera pulita.",positive,neutral,positive,neutral,neutral,positive,neutral,neutral
Wi Fi deve essere gratis,neutral,neutral,neutral,neutral,neutral,negative,neutral,neutral
A seguito di tale carenze il costo per notte è risultato esorbitante benche si deve considerare  il fatto che  durante il ponte dell'Immacolata il prezzo  probabilmente sarà più alto rispetto ad altri giorni.,neutral,neutral,neutral,neutral,negative,neutral,neutral,neutral
"Mancavano le asciugamani e il phon, diversamente da quanto scritto sul sito e confermato nella prenotazione e telefonicamente.",neutral,negative,neutral,neutral,neutral,neutral,neutral,neutral
"Personale cordiale e disponibile, posizione perfetta per visitare il centro a piedi.",neutral,neutral,neutral,positive,neutral,neutral,positive,neutral
Ho dovuto posizionare sotto  uno dei due sportelli due monete metalliche per evitare l'allagamento del bagno.,neutral,negative,neutral,neutral,neutral,neutral,neutral,neutral
Le uova la mattina  Top,neutral,neutral,positive,neutral,neutral,neutral,neutral,neutral
lo staff molto scortese,neutral,neutral,neutral,negative,neutral,neutral,neutral,neutral
"Sala colazione bella da vedere,buffet abbondande ma non di qualità anche se collaborano con Eataly.",neutral,neutral,negative,neutral,neutral,neutral,neutral,neutral
curerei meglio i particolari nell'arredo,neutral,neutral,neutral,neutral,neutral,neutral,neutral,negative
Parcheggio esterno gratuito piccolo in confronto alla ricettività della struttura.,neutral,neutral,negative,neutral,neutral,neutral,neutral,neutral
"Credo che il prezzo sia troppo elevato, è pur sempre un 3 stelle.",neutral,neutral,neutral,neutral,negative,neutral,neutral,neutral
Scarico del bagno con doccino,neutral,negative,neutral,neutral,neutral,neutral,neutral,neutral
Un po' caro il servizio in camera  8 euro .,neutral,neutral,neutral,neutral,negative,neutral,neutral,neutral
"Comodo il letto, buona la colazione, gentile lo staff, ottima la possibilità di lasciare il bagaglio l'ultimo giorno.",neutral,positive,positive,positive,neutral,neutral,neutral,neutral
Gli arredi sono vecchi e la struttura non è all'altezza del prezzo richiesto,neutral,negative,neutral,neutral,negative,neutral,neutral,neutral
Sarebbe ideale avere più mezzi di trasporto intorno ma non è colpa dell'albergo,neutral,neutral,negative,neutral,neutral,neutral,neutral,neutral
Bagno pulito e letto comodo.,neutral,positive,neutral,neutral,neutral,neutral,neutral,neutral
Check in e Check out rapidi.,neutral,neutral,neutral,positive,neutral,neutral,neutral,neutral
"L'hotel e abbastanza costoso soprattutto in alcuni periodi, ma in buona parte li vale",neutral,neutral,neutral,neutral,positive,neutral,neutral,neutral
"Grazie eh  Nessun asciugamano, fortuna ne avevo portato uno.",neutral,neutral,negative,neutral,neutral,neutral,neutral,neutral
"Pur non dipendendo dall'albergo esiste una collusione tra taxisti che giocano sul nome dell'Hotel, ti portano ad un altro Hotel Decumani e poi ti tocca chiamare un altro taxi",neutral,neutral,neutral,neutral,neutral,neutral,neutral,negative
"Struttura silenziosa, personale gentile e disponibile, buona conoscenza della lingua inglese.",neutral,positive,neutral,positive,neutral,neutral,neutral,neutral
Il frigobar della camera non funzionava  può capitare,neutral,neutral,negative,neutral,neutral,neutral,neutral,neutral
"Le camere non sono pulite  le lenzuola del letto avevano macchie ovunque , i bagni di male in peggio... tutti i bagni sono condivisi, anche se prendete una stanza matrimoniale.",negative,neutral,neutral,neutral,neutral,neutral,neutral,neutral
La posizione è l'ideale per la visita del centro storico,neutral,neutral,neutral,neutral,neutral,neutral,positive,neutral
Lo consiglio senza alcun dubbio.,neutral,neutral,neutral,neutral,positive,neutral,neutral,neutral
Non funzionava l'aeratore in bagno.,neutral,negative,neutral,neutral,neutral,neutral,neutral,neutral
Un signore che dormiva nella nostra stanza che russava come un trattore,neutral,neutral,neutral,neutral,neutral,neutral,neutral,negative
La posizione era ottima,neutral,neutral,neutral,neutral,neutral,neutral,positive,neutral
Posizione centrale ma tranquilla.,neutral,positive,neutral,neutral,neutral,neutral,positive,neutral
Le sfogliatelle ricce a colazione.,neutral,neutral,positive,neutral,neutral,neutral,neutral,neutral
La pulizia scarsa,negative,neutral,neutral,neutral,neutral,neutral,neutral,neutral
doccia minuscola,neutral,negative,neutral,neutral,neutral,neutral,neutral,neutral
La colazione non all'altezza delle aspettative e il parcheggio troppo trafficato purtroppo per posizione logistica da gente non propriamente affidabile.,neutral,neutral,negative,neutral,neutral,neutral,neutral,neutral
Non funzionava la tv,neutral,negative,neutral,neutral,neutral,neutral,neutral,neutral
Camera un po' trascurata e mancanza teli da doccia.,neutral,negative,neutral,neutral,neutral,neutral,neutral,neutral
Bello il rooftop con vista sulla città   peccato  non fosse aperto il bar visto che era inverno.,neutral,neutral,negative,neutral,neutral,neutral,neutral,positive
Le foto proposte nel sito e da Booking non corrispondono al vero.,neutral,neutral,neutral,neutral,neutral,neutral,neutral,negative
5  Porte del box doccia rotte,neutral,negative,neutral,neutral,neutral,neutral,neutral,neutral
La vicinanza alla stazione,neutral,neutral,neutral,neutral,neutral,neutral,positive,neutral
"fronte porto, e la colazione con le sfogliatelle.",neutral,neutral,positive,neutral,neutral,neutral,positive,neutral
Personale gentile ma insoddisfatto per tutto il resto,negative,negative,negative,positive,negative,negative,negative,neutral
"Posizione eccellente, silenzioso pur essendo in posizione centrale.",neutral,positive,neutral,neutral,neutral,neutral,positive,neutral
In generale l'alberogo è ben strutturato e confortevole e situato in posizione strategica,neutral,positive,neutral,neutral,neutral,neutral,positive,positive
"La posizione , la camera spaziosa, letto e cuscini comodi, parcheggio funzionale",neutral,positive,positive,neutral,neutral,neutral,positive,neutral
"Niente,uno schifo assoluto credo che mi farò restituire i miei soldi",neutral,neutral,neutral,neutral,neutral,neutral,neutral,negative
"Attento e premuroso lo staff, che ha provveduto al cambio della stanza.",neutral,neutral,neutral,positive,neutral,neutral,neutral,neutral
Il collegamento al Wifi dovrebbe essere più semplice e immediato inoltre la linea non adeguata.,neutral,neutral,neutral,neutral,neutral,negative,neutral,neutral
Uno spritz aperol a 10 euro credo sia eccessivo,neutral,neutral,neutral,neutral,negative,neutral,neutral,neutral
il parcheggio troppo caro,neutral,neutral,negative,neutral,neutral,neutral,neutral,neutral
La scortesia del personale alla reception.,neutral,neutral,neutral,negative,neutral,neutral,neutral,neutral
Le stanze sono piccole ma realizzate nel miglior modo possibile nella antica struttura.,neutral,negative,neutral,neutral,neutral,neutral,neutral,neutral
Ottima posizione in centro storico.,neutral,neutral,neutral,neutral,neutral,neutral,positive,neutral
"Hotel abbastanza carino, situato al centro di Milano praticamente su corso buenos ares  Ha il necessario per passare una notte tranquilla, pulizia abbastanza buona  Mancano alcune piccole cosa come asciugamani, o campioncini di bagnoschiuma e saponette ma sono cose di secondaria importanza  Ottimo per ragazzi giovani che vogliono uscire la sera e posso tornare a piedi, zona un p  chiassosa la notte",neutral,neutral,negative,neutral,neutral,neutral,positive,neutral
non si può tenere così un hotel nel centro di Napoli.,neutral,neutral,neutral,neutral,neutral,neutral,neutral,negative
"Situata a due passi dalla stazione centrale, consigliatissima.",neutral,neutral,neutral,neutral,neutral,neutral,positive,neutral
Di fronte alle mie rimostranze la risposta è stata   non è un problema mio e comunque sono cose che succedono .,neutral,neutral,neutral,negative,neutral,neutral,neutral,neutral
"Vicino trovate anche il giardino botanico, ingresso gratuito.",neutral,neutral,neutral,neutral,neutral,neutral,positive,neutral
"Qualità del sonno, ovvero migliorare l'insonorizzazione delle camere",neutral,negative,neutral,neutral,neutral,neutral,neutral,neutral
"Per essere un Hotel 4 Stelle pensavo di trovare di meglio  al momento della prenotazione  circa metà del mese di ottobre  non pensavo di dover soggiornare in un bilocale  a detta del personale la miglior  suite  che avevano  situato, però, all'esterno della struttura principale  certamente ho capito male io... ma non penso... .",neutral,neutral,neutral,neutral,neutral,neutral,neutral,negative
a colazione i cornetti sono riempiti al momento con una crema buonissima,neutral,neutral,positive,neutral,neutral,neutral,neutral,neutral
"la posizione sotto i ponti della tangenziale,anche se era di mattina presto niente colazione solamente un caffe pessimo in cialde ,un cappuccino mediocre e' la cosa vista solamente di mattina i cuscini sotto le federe di una sporcizia assoluta ,la camera 110 piccolissima i muri che hanno bisogno di una tinteggiatura e non basta mettere un profumatore di ambienti per celare non so cosa ,.",negative,negative,negative,neutral,neutral,neutral,negative,neutral
lo consiglio a tutti.,neutral,neutral,neutral,neutral,neutral,neutral,neutral,negative
Posizione comoda di fianco alla stazione ma con  popolazione  che ci si può aspettare nei pressi di una stazione.,neutral,neutral,neutral,neutral,neutral,neutral,negative,neutral
Le stanze puzzavano di chiuso.,neutral,negative,neutral,neutral,neutral,neutral,neutral,neutral
Le stanze al primo piano sopra la sala colazione dalle 8 del mattino vengono disturbate dallo spostamento delle sedie nella sala sottostante,neutral,negative,neutral,neutral,neutral,neutral,neutral,neutral
"Buona la colazione, staff molto gentile, posizione impagabile per chi ama un pò di caos e movimento.",neutral,neutral,positive,positive,neutral,neutral,positive,neutral
"Però  almeno era pulito,portatevi gli asciugamani c'era solo un telo grande da bagno.",positive,negative,neutral,neutral,neutral,neutral,neutral,neutral
"La posizione è comoda per muoversi, si accede facilmente alla stazione, ma piuttosto brutta per ciò che circonda l'hotel.",neutral,neutral,neutral,neutral,neutral,neutral,negative,neutral
"Il recente rinnovamento della struttura, anche se con mobili Ikea è di piacevolissimo impatto.",neutral,neutral,neutral,neutral,neutral,neutral,neutral,positive
"Migliorare la colazione per un albergo del genere è d'obbligo, croissant piccoli e duri e frutta acerba",neutral,neutral,negative,neutral,neutral,neutral,neutral,neutral
"a partire dalle foto di booking che non rispecchiano la struttura, stanze fredde e sporche e bagno maleodorante, colazione scarsa",negative,negative,negative,neutral,neutral,neutral,neutral,neutral
"Ottima posizione, personale accogliente e gentile, camera originale",neutral,neutral,neutral,positive,neutral,neutral,positive,positive
Migliorerei il servizio asciugamani e lenzuola che deve essere pagato a parte.,neutral,neutral,negative,neutral,neutral,neutral,neutral,neutral
"Imparare a fare il cappuccino, Evitare le riunioni di ospiti con la loro guida in piena sala prima colazione,",neutral,negative,negative,neutral,neutral,neutral,neutral,neutral
"Ottimo raporto qualità prezzo, posizione strategica per chi vuole visitare il centro storico.",neutral,neutral,neutral,neutral,positive,neutral,positive,neutral
Letti comodi  Ottima posizione della struttura.,neutral,positive,neutral,neutral,neutral,neutral,positive,neutral
la struttura si trova nel centro di Napoli.,neutral,neutral,neutral,neutral,neutral,neutral,positive,neutral
aggiungerei un attaccapanni nelle stanze e mancava il tappetino per la doccia,neutral,neutral,negative,neutral,neutral,neutral,neutral,neutral
Posizione centrale buona per una breve visita della città.,neutral,neutral,neutral,neutral,neutral,neutral,positive,neutral
Colazione varia e ottima,neutral,neutral,positive,neutral,neutral,neutral,neutral,neutral
"Camera  306  molto sobria e piccola, dimensioni letto minime, potenza lampadine troppo bassa, qualche piccola imperfezione nella pulizia, solo essenziali gadget.",negative,negative,neutral,neutral,neutral,neutral,neutral,neutral
Nella camera c'era un bollitore per prepararsi un the ma la spina non entrava nell'unica presa di corrente.,neutral,neutral,negative,neutral,neutral,neutral,neutral,neutral
struttura di livello superiore pulita  silenziosa,positive,positive,neutral,neutral,neutral,neutral,neutral,positive
I prezzi del parcheggio e della colazione veramente sproporzionati.,neutral,neutral,neutral,neutral,negative,neutral,neutral,neutral
Decisamente meglio la deluxe che ho già occupato altre volte e con costi inferiori.,neutral,neutral,neutral,neutral,neutral,neutral,neutral,neutral
tutto molto bello e professionale,neutral,positive,positive,positive,positive,neutral,neutral,neutral
Il wifi non prendeva nella mia camera  ritengo comunque sia stato un semplice caso .,neutral,neutral,neutral,neutral,neutral,negative,neutral,neutral
L'arredo e gli infissi delle camere sono da sistemare.,neutral,neutral,neutral,neutral,neutral,neutral,neutral,negative
Posizione buona per metro',neutral,neutral,neutral,neutral,neutral,neutral,positive,neutral
è distante dal centro città.,neutral,neutral,neutral,neutral,neutral,neutral,negative,neutral
Per la prima e seconda notte la camera che ci avevano assegnato non era affatto delle migliori.,neutral,negative,neutral,neutral,neutral,neutral,neutral,neutral
"E' un po fuorimano rispetto alle attrazioni turistiche della città, e dal centro negli orari di punta ci vuole un po prima di arrivare in albergo visto il traffico.",neutral,neutral,neutral,neutral,neutral,neutral,negative,neutral
I bagni ...un po' datati.,neutral,neutral,neutral,neutral,neutral,neutral,neutral,negative
"La suite comoda e lussuosa, il rapporto qualità prezzo, la posizione comoda da raggiungere in auto, il ristorante la colazione",neutral,positive,neutral,neutral,neutral,neutral,positive,neutral
Camera un po' piccola,neutral,negative,neutral,neutral,neutral,neutral,neutral,neutral
"Anche se la vista è magnifica l'hotel è in una posizione infelice per chi, come me, doveva muoversi per lavoro.",neutral,neutral,neutral,neutral,neutral,neutral,negative,neutral
Per il prezzo la camera era un po piccola,neutral,negative,neutral,neutral,negative,neutral,neutral,neutral
"Ottima posizione, bella la camera e buona la colazione",neutral,neutral,positive,neutral,neutral,neutral,positive,positive
"Un plauso al portiere di notte,  gentilissimo,  professionale e sorridente.",neutral,neutral,neutral,positive,neutral,neutral,neutral,neutral
"Ampiezza delle stanze, troppi letti in poco spazio",neutral,negative,neutral,neutral,neutral,neutral,neutral,neutral
"Le stanze sono troppo piccole per un albergo del genere , è chiaro che solo alcune sono così piccole ma non si sarebbero dovute fare di queste dimensioni comunque",neutral,negative,neutral,neutral,neutral,neutral,neutral,neutral
"Nel complesso un buon Hotel, forse un po' carente per essere un 4 stelle.",neutral,neutral,neutral,neutral,neutral,neutral,neutral,negative
Materasso molto duro e scomodo,neutral,negative,neutral,neutral,neutral,neutral,neutral,neutral
buona la posizione vicino alla stazione e alla metro,neutral,neutral,neutral,neutral,neutral,neutral,positive,neutral
"Ottima la cena nell'hotel,servita da personale gentilissimo,locale tranquillo",neutral,positive,positive,positive,neutral,neutral,neutral,neutral
stanza un filino piccola,neutral,negative,neutral,neutral,neutral,neutral,neutral,neutral
Arredata con stile moderno,neutral,neutral,neutral,neutral,neutral,neutral,neutral,positive
"Anche la stanza,ottima,abbiamo riposato bene.",neutral,positive,neutral,neutral,neutral,neutral,neutral,neutral
Abbiamo alloggiato in questo albergo solo una notte per via della fiera in corso...lo staff sin dall accoglienza è stato molto cordiale e gentile nel darci indicazioni riguardo il raggiungimento della fiera e riguardo la città.,neutral,neutral,neutral,positive,neutral,neutral,neutral,neutral
Ero ad un congresso e ho potuto usufruire della connessione wi fi sia in camera che al centro congressi.,neutral,neutral,neutral,neutral,neutral,positive,neutral,neutral
Nonostante la vicinanza della stazione di Bologna è risultata silenziosa e ben isonorizzata.,neutral,positive,neutral,neutral,neutral,neutral,neutral,neutral
"Breakfast eccellente, silenziosità, stanza e bagno spaziosi",neutral,positive,positive,neutral,neutral,neutral,neutral,neutral
"ottima ricezione e ottima colazione ,",neutral,neutral,positive,positive,neutral,neutral,neutral,neutral
"Camera bella, essenziale chiara con bagno fenestrato   raro in città .",neutral,neutral,neutral,neutral,neutral,neutral,neutral,positive
Il bagno aveva il lavandino intasato.,neutral,negative,neutral,neutral,neutral,neutral,neutral,neutral
"Tutto  Il personale egiziano er pigro e inefficiente, totale mancanza di gentilezza e correttezza.",neutral,neutral,neutral,negative,neutral,neutral,neutral,neutral
"Ottima prima colazione, completa e ben sistemata nella sala .",neutral,neutral,positive,neutral,neutral,neutral,neutral,neutral
"Personale eccezionale, disponibilissimo e gentilissimo",neutral,neutral,neutral,positive,neutral,neutral,neutral,neutral
"Degni di lode sia il materasso ortopedico    FANTASTICO...big size...  che la possibilità di scegliere il cuscino, asseconda delle proprie esigenze.",neutral,positive,neutral,neutral,neutral,neutral,neutral,neutral
Colazione ottima e abbondante Posizione ottimale di fronte a stazione ferroviaria,neutral,neutral,positive,neutral,neutral,neutral,positive,neutral
La cucina ho ordinato gli spaghetti di gragnano ma erano spaghetti normali e le vongole erano gelo nn veraci peccato per un hotel così curato,neutral,neutral,negative,neutral,neutral,neutral,neutral,neutral
"se il bagno fosse un pò piu' moderno, sarebbe un ottimo hotel.",neutral,neutral,neutral,neutral,neutral,neutral,neutral,negative
Personale molto gentile e disponibilissimo.,neutral,neutral,neutral,positive,neutral,neutral,neutral,neutral
"Colazione molto minimal e con poca scelta per il salato, niente frigobar in camera.",neutral,neutral,negative,neutral,neutral,neutral,neutral,neutral
E' presente il servizio reception 24h 24 e i ragazzi che vi lavorano sono tutti molto gentili.,neutral,neutral,positive,positive,neutral,neutral,neutral,neutral
"buona colazione, abbondante e genuina, prezzo onesto, bagno decente, personale professionale e cortese",neutral,positive,positive,positive,positive,neutral,neutral,neutral
La posizione consente di raggiungere il centro in dieci minuti a piedi,neutral,neutral,neutral,neutral,neutral,neutral,positive,neutral
"Camera grande , ma un po datata, così come il bagno, fermo restando che ci tornerei, in quanto pulita e confortevole.",positive,positive,neutral,neutral,neutral,neutral,neutral,negative
"colazione abbastanza abbondante , staff  molto gentile , camera molto silenziosa, aria condizionata ideale",neutral,positive,positive,positive,neutral,neutral,neutral,neutral
"Le stanze, pulite comode e ampie.",positive,positive,neutral,neutral,neutral,neutral,neutral,neutral
"Sicuramente lo staff, Steve che lo trovate all'accoglienza è stato molto disponibile nei nostri confronti, indicandoci la metro, i punti di ristoro, su come arrivare in determinati punti della città e procurandoci tutto quello che serviva per il nostro pernottamento.",neutral,neutral,neutral,positive,neutral,neutral,neutral,neutral
Manca porta rifiuti al tavolo della colazione.,neutral,neutral,negative,neutral,neutral,neutral,neutral,neutral
"Seppur breve, il soggiorno è stato molto piacevole.",neutral,neutral,neutral,neutral,positive,neutral,neutral,neutral
"Buon Hotel in pieno centro, camera confortevole e bagno delle giuste dimensioni",neutral,positive,neutral,neutral,neutral,neutral,neutral,neutral
"Camere un po' piccole ma tutto con tutto al suo posto, in un 4 stelle superior necessaria la presenza delle ciabatte marchiate dell'hotel e dell'accappatoio al posto del telo.",neutral,negative,neutral,neutral,neutral,neutral,neutral,neutral
"Piatto doccia che si allaga a doccia in funzione, telecomando TV con pulsante di spegnimento non funzionante, cappuccio e caffè da macchinetta automatica.",neutral,negative,negative,neutral,neutral,neutral,neutral,neutral
"Buona colazione, ampie camere e pulizia",positive,positive,positive,neutral,neutral,neutral,neutral,neutral
super panorama dalla sala breakfast... e sfogliatelle ottime.,neutral,neutral,positive,neutral,neutral,neutral,positive,neutral
"Colazione eccezionale, personale cordiale e gentilissimo, edificio molto bello ed elegante",neutral,positive,positive,positive,neutral,neutral,neutral,neutral
"Vicinanza alla stazione, posizione in via laterale tranquilla a due passi dai portici con le tipiche osterie bolognesi",neutral,neutral,neutral,neutral,neutral,neutral,positive,neutral
Il Personale del ricevimento non conosce l'abc dell'accoglienza del cliente.,neutral,neutral,neutral,negative,neutral,neutral,neutral,neutral
Bella camera spaziosa ed accogliente.,neutral,positive,neutral,neutral,neutral,neutral,neutral,neutral
"la colazione di basso livello non in linea con un hotel tre stelle,.",neutral,neutral,negative,neutral,neutral,neutral,neutral,neutral
"Location importante, educazione e pulizia.",positive,neutral,neutral,positive,neutral,neutral,positive,neutral
La pozione ottima davanti alla stazione.,neutral,neutral,neutral,neutral,neutral,neutral,positive,neutral
"per chi non è abituato ai palazzi antichi del centro storico di Napoli, la facciata del palazzo e le scale possono dare l'idea di una struttura fatiscente.",neutral,neutral,neutral,neutral,neutral,neutral,neutral,negative
Colazione un po' scarna ... parcheggio non presente ... stanza un po' impolverata,negative,neutral,negative,neutral,neutral,neutral,neutral,neutral
Camera lato monte bunker Temperatura camera esagerata,neutral,negative,neutral,neutral,neutral,neutral,neutral,neutral
Non è così vicino al centro storico come speravo,neutral,neutral,neutral,neutral,neutral,neutral,negative,neutral
la seconda volta che soggiorno in questo albergo mi trovo sempre molto bene.,neutral,neutral,neutral,neutral,neutral,neutral,neutral,positive
Molti rumori si avvertono in stanza e non si riposa bene.,neutral,negative,neutral,neutral,neutral,neutral,neutral,neutral
purtroppo la prima mattina abbiamo dovuto aspettare 20 min. che si liberasse un tavolo per colazione.,neutral,neutral,negative,neutral,neutral,neutral,neutral,neutral
L'odore di stantio in bagno e i rumori provenienti dall strada.,neutral,negative,neutral,neutral,neutral,neutral,neutral,neutral
"La camera era abbastanza grande, non ci siamo messi a controllare se fosse sporca perché eravamo stanchissimi però non ci è sembrata male, arrivava il wifi e poiché non c'era nessun altro il bagno era tutto per noi.",neutral,positive,neutral,neutral,neutral,positive,neutral,neutral
"Dalla struttura è facilmente raggiungibile la stazione centrale,la fermata Loreto della metro linea 1, bar e ristoranti.",neutral,neutral,neutral,neutral,neutral,neutral,positive,neutral
"fanno schifo, il bagno sporco la stanza puzza anche il asciugamano puzzava tanto.",negative,neutral,neutral,neutral,neutral,neutral,neutral,neutral
Colazione molto ricca e buona.,neutral,neutral,positive,neutral,neutral,neutral,neutral,neutral
In 4 giorni che sono stata lì non hanno mai dato una pulita o riordinata alla mia camera.,negative,neutral,neutral,neutral,neutral,neutral,neutral,neutral
"Ci siamo trovati benissimo, ci torneremo  Quando siamo andati via ho chiesto anche un mezzo litro di acqua e gentilmente ci è stata offerta.",neutral,neutral,positive,positive,neutral,neutral,neutral,neutral
Metro a 5 minuti a piedi di distanza e fermata taxi sotto l albergo.,neutral,neutral,neutral,neutral,neutral,neutral,positive,neutral
Non ha il parcheggio a differenza di quanto riportato nella presentazione,neutral,neutral,negative,neutral,neutral,neutral,neutral,neutral
wifi inesistente e colazione veramente immangiabile,neutral,neutral,negative,neutral,neutral,negative,neutral,neutral
Stanza un po' piccola.,neutral,negative,neutral,neutral,neutral,neutral,neutral,neutral
Moquette sporca in tutto il piano 7.,negative,neutral,neutral,neutral,neutral,neutral,neutral,neutral
prodotti da bagno e rete un po' lenta.,neutral,neutral,negative,neutral,neutral,negative,neutral,neutral
"La posizione strategica per visitare la città, la flessibilità degli orari, personale disponibile.",neutral,neutral,neutral,positive,neutral,neutral,positive,positive
"rapporto qualità prezzo forse un po' inpari , buffet a colazione un po' scarso.",neutral,neutral,negative,neutral,negative,neutral,neutral,neutral
"Tremendo... Posizionato nel ghetto di Napoli  occhio a camminarci la sera , la struttura è davvero fatiscente.",neutral,neutral,neutral,neutral,neutral,neutral,negative,negative
Disponibilità di garage  a pagamento  nel marciapiedi opposto,neutral,neutral,positive,neutral,neutral,neutral,neutral,neutral
