sentence,cleanliness,comfort,amenities,staff,value,wifi,location,other
Non è possibile vedere Mediaset a causa della presenza del decoder Sky e dell'impossibilità di scollegarlo.,neutral,neutral,negative,neutral,neutral,neutral,neutral,neutral
"Posizione strategica, pulizia ottima staff efficiente.",positive,neutral,neutral,positive,neutral,neutral,positive,neutral
"La struttura ha un'ottima posizione sul mare, ma la mia camera era interna e quindi con poca luce ed assenza totale di panorama  Mi ero ripromesso di andare a Capri ma, visto l'affollamento di turisti delle mega navi che affollavano il molo Beverello per imbarcarsi per l'isola, ho preferito godermi il lungomare di Napoli",neutral,negative,neutral,neutral,neutral,neutral,positive,neutral
"lo staff è gentile, cortese , ma molto molto freddo.",neutral,neutral,neutral,negative,neutral,neutral,neutral,neutral
"La prima colazione, la vicinanza alla Metropolitana di Piazza Leopardi, i ristoranti pizzerie Di Napoli e Cafasso in zona.",neutral,neutral,positive,neutral,neutral,neutral,positive,neutral
"La camera 312 che mi è stata assegnata  al terzo piano di cui solo due piani raggiungibili con ascensore , dà su un cortiletto interno deprimente e degradato.",neutral,negative,neutral,neutral,neutral,neutral,neutral,neutral
Cordialità ed ospitalità ottima.,neutral,neutral,neutral,positive,neutral,neutral,neutral,neutral
"La mia stanza per disabili  non richiesta e non comunicata  aveva i problemi topici dei bagni di questo tipo di stanze, in particolare la doccia senza box.",neutral,negative,neutral,neutral,neutral,neutral,neutral,neutral
Metterei un abat jour nella camera.....,neutral,negative,neutral,neutral,neutral,neutral,neutral,neutral
Far pagare 2 euro per i teli in piscina è una piccineria non consona ad una struttura di questa categoria.,neutral,neutral,negative,neutral,negative,neutral,neutral,neutral
La gentilezza del personale,neutral,neutral,neutral,positive,neutral,neutral,neutral,neutral
La struttura è semplice e pulita .,positive,neutral,neutral,neutral,neutral,neutral,neutral,positive
In questo ostello cordialità e simpatia sono all'ordine del giorno.,neutral,neutral,neutral,positive,neutral,neutral,neutral,neutral
Cortesia dei proprietari...posizione eccezionale...camera spaziosissima....tutto perfetto.,neutral,positive,neutral,positive,neutral,neutral,positive,neutral
Posizione perfetta per raggiungere l'aeroporto,neutral,neutral,neutral,neutral,neutral,neutral,positive,neutral
"la camera ed il bagno sono arredati in modo efficiente ed elegante, la colazione è sicuramente di livello, la gentilezza e la cortesia del personale è un plus che non tutti i 4 stelle  sanno offrire, quindi bravi",neutral,positive,positive,positive,neutral,neutral,neutral,neutral
"Personale molto cordiale e educato,",neutral,neutral,neutral,positive,neutral,neutral,neutral,neutral
"Questo non è un hotel ma un B B con più stanze della media, un nome che confonde chi prenota.",neutral,neutral,neutral,neutral,neutral,neutral,neutral,negative
Posizione ottima esattamente di fronte alla stazione.,neutral,neutral,neutral,neutral,neutral,neutral,positive,neutral
Il menù fisso...Molto povero e notevole dislivello tra qualità  prezzo,neutral,neutral,negative,neutral,neutral,neutral,neutral,neutral
Inoltre non vi è la presenza di prese elettriche accanto al letto.,neutral,negative,neutral,neutral,neutral,neutral,neutral,neutral
",niente colazione niente frigo bar in camera,bagno vecchio,rumori vari.",neutral,negative,negative,neutral,neutral,neutral,neutral,neutral
Il letto era leggermente scomodo,neutral,negative,neutral,neutral,neutral,neutral,neutral,neutral
Camera con pareti da tinteggiare.,neutral,neutral,neutral,neutral,neutral,neutral,neutral,negative
Il materasso era comodo e la ricotta a colazione era super,neutral,positive,positive,neutral,neutral,neutral,neutral,neutral
"Camera molto pulita,personale molto gentile e disponibile,colazione a buffet con diverse scelte",positive,neutral,positive,positive,neutral,neutral,neutral,neutral
"Un veglione di Capodanno  uro 250,00 a persona mi sembra esagerato.",neutral,neutral,neutral,neutral,negative,neutral,neutral,neutral
"Personalmente non amo i letti alla francese, ma è questione di gusti.",neutral,negative,neutral,neutral,neutral,neutral,neutral,neutral
"Non attenzione per i dettagli anche banali , odore di fumo nella camera , niente phon e poco socievole il personale , non possibilità di fare colazione",neutral,negative,negative,negative,neutral,neutral,neutral,neutral
"Eravamo in tre a cenare nel ristorante dell'albergo, ognuno aveva scelto una portata diversa ma eravamo tutti ugualmente soddisfatti.",neutral,neutral,positive,neutral,neutral,neutral,neutral,neutral
"La struttura in generale, carente la hall dell'albergo, camere pessime, serramenti non funzionanti  persiane, mancanza di maniglie sulle finestre , pulizia camere e bagno pessima.",negative,negative,neutral,neutral,neutral,neutral,neutral,negative
Personale molto professionale e tutti i confort che ci potevamo attendere da un albergo a 4 stelle.,neutral,positive,neutral,positive,neutral,neutral,neutral,neutral
gentilissimo il ragazzo ucraino alle reception,neutral,neutral,neutral,positive,neutral,neutral,neutral,neutral
Conoscevo già la struttura e i sono tornata per la posizione comoda rispetto ai miei impegni.,neutral,neutral,neutral,neutral,neutral,neutral,positive,neutral
Tutto molto buono  Vista eccezionale,neutral,neutral,neutral,neutral,neutral,neutral,neutral,positive
L'addetta alla reception del check out è stata cordiale e professionale.,neutral,neutral,neutral,positive,neutral,neutral,neutral,neutral
"Bellissima la stanza con vista mare, anche la terrazza dove vengono consumati i pasti è uno spettacolo",neutral,positive,neutral,neutral,neutral,neutral,positive,neutral
La stanza aveva un forte odore di colla e vernice dato i lavori appena finiti.,neutral,negative,neutral,neutral,neutral,neutral,neutral,neutral
Le camere ed il bagno sono vecchi,neutral,neutral,neutral,neutral,neutral,neutral,neutral,negative
Accesso e posteggio non dei più facili,neutral,neutral,neutral,neutral,neutral,neutral,neutral,negative
Finestre insonorizzate impediscono di sentire traffico e cantieri in zona.,neutral,positive,neutral,neutral,neutral,neutral,neutral,neutral
"posizione strepitosa, stile intrigante",neutral,neutral,neutral,neutral,neutral,neutral,positive,positive
I crassant mangiabile non eccezionale  materasso buono,neutral,positive,negative,neutral,neutral,neutral,neutral,neutral
"La stanza ed il bagno erano puliti ed in ordine, il personale è stato disponibile anche a custodire i bagagli dopo il check out in modo da permetterci di muoverci per la città più agilmente fino all'ora della nostra partenza.",positive,positive,positive,positive,neutral,neutral,neutral,neutral
Per il resto........rapporto qualità prezzo discutibile e personale quasi assente.,neutral,neutral,neutral,negative,negative,neutral,neutral,neutral
Ottima posizione per visitare Napoli Centro,neutral,neutral,neutral,neutral,neutral,neutral,positive,neutral
"la posizione, la gentilezza e disponibilità dello staff",neutral,neutral,neutral,positive,neutral,neutral,positive,neutral
vicinanza alla stazione centrale e alla fermata della metro  possibilità di effettuare il check in un po' prima rispetto all'orario stabilito,neutral,neutral,neutral,neutral,neutral,neutral,positive,neutral
La fila all'ingresso della sala della colazione  in un 4 stelle non si può accettare.,neutral,neutral,negative,neutral,neutral,neutral,neutral,neutral
Staff molto gentile e disponibile.,neutral,neutral,neutral,positive,neutral,neutral,neutral,neutral
E' bene arrivare preparati a trovare spazzatura ovunque per strada     ... anche il traffico proprio niente male,neutral,neutral,neutral,neutral,neutral,neutral,negative,neutral
"Colazione varia e abbondante in locale piacevole, che dà sul cortile interno,  con grandi vetrate.",neutral,neutral,positive,neutral,neutral,neutral,neutral,neutral
"Infatti, le stanze sono molto piccole e scomode e richiedono un grande spirito di adattamento e, comunque, una motivazione a visitare la città che superi l'aspetto  comfort  del soggiorno   D'altra parte il prezzo credo sia basso proprio per questo.",neutral,negative,neutral,neutral,neutral,neutral,neutral,neutral
"Per farmi dare la stanza ho dovuto battere i pugni sul tavolo, nella prima ora sono entrate nella mia stanza 2 persone dipendenti dell'hotel",neutral,neutral,neutral,neutral,neutral,neutral,neutral,negative
"Il parcheggio distante e mal segnalato, specialmente se come nel mio caso si ha un bambino piccolo.",neutral,neutral,negative,neutral,neutral,neutral,neutral,neutral
"La mia camera dava sulla strada ed era impossibile tenere la finestra aperta, troppo rumore.",neutral,negative,neutral,neutral,neutral,neutral,neutral,neutral
Odore di posto chiuso nella stana e docccia rotta in quando il flusso era rivolto verso la parete e non era possibile direzionarlo,negative,negative,neutral,neutral,neutral,neutral,neutral,neutral
Buono anche il ristorante,neutral,neutral,positive,neutral,neutral,neutral,neutral,neutral
La camera famigliare aveva il divano letto e non era stato specificato al momento della prenotazione.,neutral,negative,neutral,neutral,neutral,neutral,neutral,neutral
mi hanno dato la camera accanto al bistro e mi ha dato fastidio la musica con il volume altissimo fino alla chiusura.,neutral,negative,neutral,neutral,neutral,neutral,neutral,neutral
Avendo letto le recensioni...Gli ascensori per arrivare al terzo piano...spesso non funzionavano.,neutral,neutral,negative,neutral,neutral,neutral,neutral,neutral
"Finestre che non si aprono, stanza sporca",negative,negative,neutral,neutral,neutral,neutral,neutral,neutral
Camere un po  spoglie per un 4 stelle,neutral,neutral,neutral,neutral,neutral,neutral,neutral,negative
"Letto comodissimo, bagno pulito e spazioso.",positive,positive,neutral,neutral,neutral,neutral,neutral,neutral
"Il bagno probabilmente risale a qualche decennio fa  ho trovato la vasca con tendina, che trovo anche non igienica.",negative,neutral,neutral,neutral,neutral,neutral,neutral,neutral
Non è il primo hotel che giro tra via Marsala e via Milazzo ma questo è stato sicuramente il peggiore.,neutral,negative,neutral,neutral,neutral,neutral,neutral,neutral
Colazione fantastica panorama unico,neutral,neutral,positive,neutral,neutral,neutral,neutral,positive
"Buona la colazione, ma non eccezionale come mi sarei aspettato delle recensioni  ne ho visto di gran meglio .",neutral,neutral,negative,neutral,neutral,neutral,neutral,neutral
le lenzuola  e glia eredi della stanza non erano a mio avviso adeguati,neutral,negative,neutral,neutral,neutral,neutral,neutral,negative
"per riuscire ad entrare, dato che il termine per il check in era alle 18.30, ho dovuto insistere perché mi accettassero alle 21.30  orario di arrivo del treno, che poi ha avuto un ritardo per una disgrazia lungo la linea... , nonostante avessi scelto la struttura perché vicinissima alla stazione ferroviaria, dove per altro vi era anche la sede dell'aggiornamento  per lavoro , motivo del mio viaggio.",neutral,neutral,negative,neutral,neutral,neutral,positive,neutral
In camera c'era poco spazio nonostante fosse una superior.,neutral,negative,neutral,neutral,neutral,neutral,neutral,neutral
"Posizione comoda, vicinissima alla Stazione Centrale di Napoli.",neutral,neutral,neutral,neutral,neutral,neutral,positive,neutral
Il personale tutto è mediamente educato e cortese con gli ospiti.,neutral,neutral,neutral,positive,neutral,neutral,neutral,neutral
Ospiti rumorosi durante la notte.,neutral,neutral,neutral,neutral,neutral,neutral,neutral,negative
"Ottima posizione, centrale ma silenziosa.",neutral,neutral,neutral,neutral,neutral,neutral,positive,neutral
"Non ho cenato dato che sono arrivato molto tardi e non ho potuto giudicare il ristorante , la colazione e' stata ottima e varia un solo appunto la mancanza della pancetta  sostituita con wurstel , Nel complesso una buona permanenza ed un prezzo in offerta molto buono .",neutral,neutral,negative,neutral,positive,neutral,neutral,neutral
Sono molto felice che abbiano ascoltato la mia richiesta di stare a un piano diverso dal primo e infatti l illuminazione era pazzesca.,neutral,neutral,neutral,neutral,neutral,neutral,neutral,positive
Personale disponibile e gentilissimo.,neutral,neutral,neutral,positive,neutral,neutral,neutral,neutral
"Inoltre, abbiamo avuto problemi con la cassetta di sicurezza.",neutral,neutral,negative,neutral,neutral,neutral,neutral,neutral
"Camera ampia e silenziosa, TV grande, arredi attuali e funzionali  ad es. armadio con specchio illuminato, letto imbottito .",neutral,positive,positive,neutral,neutral,neutral,neutral,neutral
Alcune rifiniture nei corridoi e camere sono vecchie ...,neutral,neutral,neutral,neutral,neutral,neutral,neutral,negative
"La nostra camera era spaziosa e silenziosa, con letto e cuscino comodi.",neutral,positive,neutral,neutral,neutral,neutral,neutral,neutral
ottimo rapporto qualità prezzo,neutral,neutral,neutral,neutral,positive,neutral,neutral,neutral
L'albergo è di buona qualità.,neutral,neutral,neutral,neutral,neutral,neutral,neutral,positive
"Non sono presenti asciugamani, nè bagnoschiuma shampoo.",neutral,neutral,negative,neutral,neutral,neutral,neutral,neutral
"Ristrutturato molto bene, con un gusto particolare.",neutral,neutral,neutral,neutral,neutral,neutral,neutral,positive
"La qualità dei prodotti a colazione e il personale sia in reception che a colazione  molto gentili, disponibili e professionali",neutral,neutral,positive,positive,neutral,neutral,neutral,neutral
La posizione è meravigliosa con una vista stupenda sul mare.,neutral,neutral,neutral,neutral,neutral,neutral,positive,positive
"La cucina è a vostra disposizione, un ambiente molto carino.",neutral,positive,positive,neutral,neutral,neutral,neutral,neutral
"La stanza era umida, non accogliente, non mi sembrava nemmeno troppo pulita e 10 minuti dopo me ne sono andato.",negative,negative,neutral,neutral,neutral,neutral,neutral,neutral
L'ascensore per accedere al piano è davvero minuscolo.,neutral,negative,neutral,neutral,neutral,neutral,neutral,neutral
"letto pessimo, metà durissimo e metà infossato.",neutral,negative,neutral,neutral,neutral,neutral,neutral,neutral
Letto ampio e comodissimo.,neutral,positive,neutral,neutral,neutral,neutral,neutral,neutral
La splendida posizione e la colazione super,neutral,neutral,positive,neutral,neutral,neutral,positive,neutral
Camera spaziosa   bagno nuovo e ampio   arredamento nuovo   Parcheggio a pagamento 1 euro all'ora con un massimo giornaliero di 12 euro,neutral,positive,positive,neutral,neutral,neutral,neutral,neutral
Pulizia scarsa  lenzuola con polvere e sporcizia il personale pessimo posto lugubre ad un mese dal nostro passaggio stiamo ancora aspettando fattura,negative,negative,neutral,negative,neutral,neutral,neutral,neutral
Staff cordiale e disponibile .,neutral,neutral,neutral,positive,neutral,neutral,neutral,neutral
Affaccio su castel dell'ovo insuperabile.,neutral,neutral,neutral,neutral,neutral,neutral,neutral,positive
la seconda volta che vengo ma solo per la posizione ed il prezzo.,neutral,neutral,neutral,neutral,positive,neutral,positive,neutral
Un po' da ristrutturare,neutral,negative,neutral,neutral,neutral,neutral,neutral,neutral
"Arredamento fatiscente, letto rumoroso, pareti e rifiniture trascurate.",neutral,negative,neutral,neutral,neutral,neutral,neutral,neutral
Arredo un po  datato La Porta d ingresso della camera non si chiudeva facilmente  Parcheggio a pagamento,neutral,negative,negative,neutral,neutral,neutral,neutral,neutral
"Nel letto abbiamo trovato degli animaletti,la TV non aveva segnale,la finestra era di legno tutta rotta e dava sulla strada,non si chiudeva,con la paura che entrasse qualcuno mentre dormivamo.",negative,negative,negative,neutral,neutral,neutral,negative,neutral
Puzzo di fumo dovunque.,neutral,negative,neutral,neutral,neutral,neutral,neutral,neutral
Bagno scadente e pessimo...ascensore vecchio e stretto...,neutral,negative,negative,neutral,neutral,neutral,neutral,neutral
"Lounge bar, vista panoramica, deposito bagagli, cortesia.",neutral,neutral,positive,positive,neutral,neutral,neutral,neutral
"Per non parlare dei disagi per recarsi al centro con i mezzi pubblici, ne passa uno ogni mezz'ora e il notturno non passa proprio",neutral,neutral,neutral,neutral,neutral,neutral,negative,neutral
IN QUELLA DATA HO SENTITO FREDDO IN HOTEL ED ANCHE LA VOLTA PRECEDENTE MA ERA IL MESE DI OTTOBRE,neutral,negative,neutral,neutral,neutral,neutral,neutral,neutral
"La camera comoda e pulita, con un bagno molto spazioso, sia con doccia che con vasca.",positive,positive,neutral,neutral,neutral,neutral,neutral,neutral
"Posizione molto comoda, buon rapporto qualità prezzo",neutral,neutral,neutral,neutral,positive,neutral,positive,neutral
La posizione è comoda per chi ama camminare  e guardare le vetrine per arrivare a piazza maggiore   circa ad 1 km .,neutral,neutral,neutral,neutral,neutral,neutral,positive,neutral
Non è possibile stabilire la temperatura interna non avendo il termostato.,neutral,negative,neutral,neutral,neutral,neutral,neutral,neutral
Una volta arrivato   20 minuti dopo l'addetto era anche contrariato... non so per cosa..... Forse non era riuscito a prendere il caffè e fumarsi una sigaretta in santa pace Il resto del personale perfetto e cortese,neutral,neutral,neutral,negative,neutral,neutral,neutral,neutral
bagno spazioso e letto confortevole.,neutral,positive,neutral,neutral,neutral,neutral,neutral,neutral
Tempi biblici per avere l'acqua calda in camera.,neutral,negative,neutral,neutral,neutral,neutral,neutral,neutral
"Il rapporto qualità prezzo potrebbe essere migliorato, soprattutto il costo del parcheggio.",neutral,neutral,neutral,neutral,positive,neutral,neutral,neutral
Piscina sul tetto e area per colazione pranzo cena molto belli con vista su castel dell'ovo.,neutral,neutral,positive,neutral,neutral,neutral,neutral,neutral
Posizione centrale e super comoda.,neutral,neutral,neutral,neutral,neutral,neutral,positive,neutral
Zona colazione piccola e con pochissima scelta sul salato.,neutral,negative,negative,neutral,neutral,neutral,neutral,neutral
Ottima la disponibilità a fornire la colazione già dalle 5 del mattino.,neutral,neutral,positive,neutral,neutral,neutral,neutral,neutral
la vicinanza alla stazione centrale,neutral,neutral,neutral,neutral,neutral,neutral,positive,neutral
Ia colazione e' quella tipica da albergo  niente di speciale  il letto  e la camera confortevoli,neutral,positive,negative,neutral,neutral,neutral,neutral,neutral
Frigo bar poco assortito così come le bustine tisane  solo un tea ed una camomilla .,neutral,neutral,negative,neutral,neutral,neutral,neutral,neutral
Mi aspettavo di piu'.,neutral,neutral,neutral,neutral,negative,neutral,neutral,neutral
Ambiente comodo e accogliente.,neutral,positive,neutral,neutral,neutral,neutral,neutral,neutral
"Abbiamo scelto questo albergo per la posizione, infatti eravamo a 10 metri da Via dell'Indipendenza e da lì in 10 minuti di passeggiata si poteva raggiungere sia il centro sia la stazione.",neutral,neutral,neutral,neutral,neutral,neutral,positive,neutral
le room cleaner NON POSSONO bussare alla porta alle 8 del mattino tutte le mattine incluse il giorno della partenza.,neutral,neutral,neutral,negative,neutral,neutral,neutral,neutral
OTTIMA POSIZIONE E OTTIMO PREZZO,neutral,neutral,neutral,neutral,positive,neutral,positive,neutral
I letti sono comodi e l'ambiente è pulito e curato.,positive,positive,neutral,neutral,neutral,neutral,neutral,neutral
Più che un hotel è un bed and breakfast dislocato in più appartamenti  unica pecca  per il resto staff gentilissimo,neutral,neutral,neutral,positive,neutral,neutral,neutral,negative
Piuttosto disturbate le camere sotto la reception.,neutral,negative,neutral,neutral,neutral,neutral,neutral,neutral
Presente un deposito bagagli molto comodo e funzionale.,neutral,positive,positive,neutral,neutral,neutral,neutral,neutral
"Mi aspettavo di trovare nel buffet della colazione anche sfogliatelle, pastierine o capresi, invece tra i dolci freschi vi erano classici croissant e ciambelline  buonissimi ma poco tradizionali.",neutral,neutral,negative,neutral,neutral,neutral,neutral,neutral
Livello della struttura fuori dai prezzi offerti.,neutral,neutral,neutral,neutral,negative,neutral,neutral,neutral
"staff molto  disponibile e atmosfera che  si  respira  in questi  palazzi  signorili  ,la sala  colazioni  e  degna di un  palazzo  storico  e poi  la  vista sui  quartieri  spagnoli .",neutral,neutral,neutral,positive,neutral,neutral,neutral,positive
tutto super confortevole colazione buona,neutral,positive,positive,neutral,neutral,neutral,neutral,neutral
Ben i insonorizzata   doppia vetri nella porta finestra,neutral,positive,neutral,neutral,neutral,neutral,neutral,neutral
"Ottima posizione in centro , bellissima hall   attenzioni al cliente  camera preparata per la notte con presente",neutral,positive,neutral,neutral,neutral,neutral,positive,neutral
"Ottima colazione, personale molto gentile",neutral,neutral,positive,positive,neutral,neutral,neutral,neutral
Lo staff è molto gentile e disponibile.,neutral,neutral,neutral,negative,neutral,neutral,neutral,neutral
"Ignorano la decenza e la legge, grave per chi si attribuisce quattro stelle.",neutral,neutral,neutral,negative,neutral,neutral,neutral,neutral
Ottima posizione e staff disponibile.,neutral,neutral,neutral,positive,neutral,neutral,positive,neutral
Non prendevano segnale i canali tv principali.,neutral,neutral,negative,neutral,neutral,neutral,neutral,neutral
"Prezzo vantaggioso, staff dellea reception veramente gentile, lenzuola pulite",positive,neutral,neutral,positive,positive,neutral,neutral,neutral
Riscaldamento non funzionante bene,neutral,neutral,negative,neutral,neutral,neutral,neutral,neutral
Bagno ampio e accessoriato.,neutral,positive,neutral,neutral,neutral,neutral,neutral,neutral
"Ottima colazione, ottima camera",neutral,neutral,positive,neutral,neutral,neutral,neutral,positive
"il bagno, da rinnovare, mancano le prese.",neutral,negative,negative,neutral,neutral,neutral,neutral,neutral
Televisione obsoleta ormai neanche più in produzione.,neutral,negative,neutral,neutral,neutral,neutral,neutral,neutral
"Stile dell'hotel e accuratezza dell'allestimento della camera  asciugamani mancanti, luci malfunzionanti...",neutral,negative,negative,neutral,neutral,neutral,neutral,neutral
"Per qualche strano motivo ultimamente  la più recente questa settimana , ogni volta che lo frequento, c'è sempre un' invasiva manutenzione degli esterni che rende invivibile il tempo trascorso nella bellissima sala ristorante colazioni a causa dei rumori dei martelli pneumatici  speriamo finiscano presto.",neutral,negative,neutral,neutral,neutral,neutral,neutral,neutral
Bella vista della vecchia città dalla terrazza al 5  piano,neutral,neutral,neutral,neutral,neutral,neutral,positive,neutral
Personale scortese e struttura sporca,negative,neutral,neutral,negative,neutral,neutral,neutral,neutral
la colazione seppur molto varia la renderei un attimino piu internazionale.,neutral,neutral,negative,neutral,neutral,neutral,neutral,neutral
Wi fi non funzionava bene,neutral,neutral,neutral,neutral,neutral,negative,neutral,neutral
la finestra affacciata sul cortile non ci ha permesso di lasciare la finestra aperta.,neutral,negative,neutral,neutral,neutral,neutral,neutral,neutral
personali veramente gentili ed accogliente.,neutral,neutral,neutral,positive,neutral,neutral,neutral,neutral
sull hotel niente da ridire ma la zona è piena di spacciatori e pericolosa,neutral,neutral,neutral,neutral,neutral,neutral,negative,neutral
Ambiente mediamente curato ed ampi spazi.,neutral,positive,neutral,neutral,neutral,neutral,neutral,neutral
Non c'è riscaldamento nel bagno lavarsi era dura cosa che non dovrebbe esistere in un hotel 4 stelle,neutral,negative,neutral,neutral,neutral,neutral,neutral,neutral
odore di deodorante per ambienti fortissimo.,neutral,negative,neutral,neutral,neutral,neutral,neutral,neutral
"Colazione molto diversificata e completa, personale in sala ristorante professionale, ma fatica a salutare.",neutral,neutral,positive,negative,neutral,neutral,neutral,neutral
"Per la colazione, abbiamo apprezzato tutto, unico appunto per il caffè e cappuccino.",neutral,neutral,negative,neutral,neutral,neutral,neutral,neutral
Camera con finestre tipo lucernario e buie,neutral,negative,neutral,neutral,neutral,neutral,neutral,neutral
Migliorerei il comfort del letto e dei cuscini.,neutral,negative,neutral,neutral,neutral,neutral,neutral,neutral
Steve si è prodigato per agevolare il nostro soggiorno e si è anche  preso cura dei nostri bagagli in attesa del check in.,neutral,neutral,neutral,positive,neutral,neutral,neutral,neutral
Ottima la pulizia delle stanze,positive,neutral,neutral,neutral,neutral,neutral,neutral,neutral
Al ritiro delle valige abbiamo dovuto aspettare più di 30 minuti scoprendo che le valige erano state buttate dietro ad una colonna della hall senza che nessuno ci avesse avvertito.,neutral,neutral,negative,neutral,neutral,neutral,neutral,neutral
"Suggerimenti preziosi, calorosa e professionale cordialità dello staff.",neutral,neutral,neutral,positive,neutral,neutral,neutral,neutral
sicuramente avrei cambiato la tavoletta del vater...camera 40,neutral,negative,neutral,neutral,neutral,neutral,neutral,neutral
Ottimo anche il wi fi.,neutral,neutral,neutral,neutral,neutral,positive,neutral,neutral
Ottima posizione per chi lavora,neutral,neutral,neutral,neutral,neutral,neutral,positive,neutral
"La location ottima, in pieno centro.",neutral,neutral,neutral,neutral,neutral,neutral,positive,neutral
